{
  "thermal_result_id": "f47ac10b-58cc-4372-a567-0e02b2c3d479",
  "analysis_job_id": "a1b2c3d4-e5f6-7890-abcd-ef1234567890",
  "dataset_id": "ds-20260615-gap-cotton-thermal-001",
  "field_id": "c3d4e5f6-7890-1234-abcd-ef5678901234",
  "mission_id": "d4e5f6a7-8901-2345-bcde-f67890123456",
  "sensor_type": "FLIR_BOSON_320",
  "canopy_temperature": {
    "layer_uri": "s3://tarlaanaliz-results/2026/06/thermal/canopy_temp_f47ac10b.tif",
    "min_celsius": 22.5,
    "max_celsius": 41.3,
    "mean_celsius": 31.8
  },
  "cwsi": {
    "layer_uri": "s3://tarlaanaliz-results/2026/06/thermal/cwsi_f47ac10b.tif",
    "min_cwsi": 0.12,
    "max_cwsi": 0.78,
    "mean_cwsi": 0.43
  },
  "canopy_soil_delta": {
    "layer_uri": "s3://tarlaanaliz-results/2026/06/thermal/delta_f47ac10b.tif",
    "min_celsius": -2.1,
    "max_celsius": 8.7,
    "mean_celsius": 3.4
  },
  "irrigation_efficiency": {
    "layer_uri": "s3://tarlaanaliz-results/2026/06/thermal/irrigation_eff_f47ac10b.tif",
    "mean_efficiency": 0.62
  },
  "original_resolution": {
    "width_px": 320,
    "height_px": 256
  },
  "upsampled_resolution": {
    "width_px": 2048,
    "height_px": 1536,
    "method": "BILINEAR"
  },
  "thermal_qc": {
    "status": "PASS",
    "temperature_range_valid": true,
    "sensor_drift_detected": false,
    "notes": null
  },
  "layer_code": "THERMAL_STRESS",
  "created_at": "2026-06-15T14:30:00Z"
}
